number,value,datetime_start,datetime_complete,duration,params_activation,params_alpha,params_batch_size,params_learning_rate_init,params_n_layers,params_n_units_l0,params_n_units_l1,params_n_units_l2,params_n_units_l3,state
0,0.8589439653233626,2026-07-25 15:40:46.179234,2026-07-25 15:42:15.978873,0 days 00:01:29.799639,relu,8.629132190071855e-06,64,0.00014936568554617635,2,384,288.0,,,COMPLETE
1,0.8797477041620823,2026-07-25 15:42:16.031733,2026-07-25 15:42:50.453802,0 days 00:00:34.422069,tanh,0.0003905441275210792,64,0.0007476312062252305,4,320,96.0,96.0,96.0,COMPLETE
2,0.8758132355213226,2026-07-25 15:42:50.498294,2026-07-25 15:43:06.529502,0 days 00:00:16.031208,tanh,1.899776347411128e-06,512,0.006647135865318032,2,320,96.0,,,COMPLETE
3,0.5837954394942373,2026-07-25 15:43:06.569846,2026-07-25 15:43:30.489667,0 days 00:00:23.919821,tanh,1.6081669283634667e-06,128,0.053451661106468214,4,128,64.0,288.0,192.0,COMPLETE
4,0.7630834669056928,2026-07-25 15:43:30.512213,2026-07-25 15:43:51.538977,0 days 00:00:21.026764,relu,0.003867228849117745,512,0.058293845429947415,3,96,384.0,320.0,,COMPLETE
5,0.8618401111860534,2026-07-25 15:43:51.560531,2026-07-25 15:44:21.577808,0 days 00:00:30.017277,relu,0.0018037506431281848,256,0.00026471141828218194,2,128,320.0,,,COMPLETE
6,0.8515778820369544,2026-07-25 15:44:21.614505,2026-07-25 15:44:23.343832,0 days 00:00:01.729327,relu,0.023661540064603175,512,0.020597335357437203,1,32,,,,COMPLETE
7,0.8298917573713049,2026-07-25 15:44:23.372913,2026-07-25 15:44:28.693472,0 days 00:00:05.320559,tanh,0.006688747907702059,512,0.04588156549160976,3,128,32.0,128.0,,COMPLETE
8,0.8562223830092451,2026-07-25 15:44:28.716171,2026-07-25 15:45:18.894991,0 days 00:00:50.178820,relu,4.4396482429275274e-06,512,0.000124247470836602,3,320,192.0,224.0,,COMPLETE
9,0.8633683347506964,2026-07-25 15:45:18.920110,2026-07-25 15:45:27.606440,0 days 00:00:08.686330,relu,2.8965395242758646e-06,128,0.0007400385759087378,1,160,,,,COMPLETE
10,0.7820684428663129,2026-07-25 15:45:27.646269,2026-07-25 15:45:46.056976,0 days 00:00:18.410707,tanh,0.5736202516305239,64,0.001774224501415529,4,224,160.0,32.0,32.0,COMPLETE
11,0.8560730782927308,2026-07-25 15:45:46.090214,2026-07-25 15:46:11.162354,0 days 00:00:25.072140,tanh,8.312259089626681e-05,64,0.007848596736294991,2,288,128.0,,,COMPLETE
12,0.8768113644671265,2026-07-25 15:46:11.179864,2026-07-25 16:22:36.389483,0 days 00:36:25.209619,tanh,0.00011817486082388006,256,0.003299668629310708,4,384,96.0,32.0,384.0,COMPLETE
13,0.8765009571012511,2026-07-25 16:22:36.409584,2026-07-25 16:23:23.118271,0 days 00:00:46.708687,tanh,0.00014889734620540665,256,0.0014793778674767762,4,384,224.0,32.0,384.0,COMPLETE
14,0.8734742913736169,2026-07-25 16:23:23.145676,2026-07-25 16:25:01.532741,0 days 00:01:38.387065,tanh,0.0001706720644212927,256,0.003920776541325162,4,256,96.0,128.0,384.0,COMPLETE
15,0.8798776297716356,2026-07-25 16:25:01.555985,2026-07-25 16:27:07.812087,0 days 00:02:06.256102,tanh,3.5194573492722104e-05,256,0.0005277819036156574,4,352,32.0,128.0,192.0,COMPLETE
16,0.8852959025257855,2026-07-25 16:27:07.849718,2026-07-25 16:28:38.475222,0 days 00:01:30.625504,tanh,3.4056760960135935e-05,64,0.00045237531547794735,3,320,32.0,160.0,,COMPLETE
17,0.8647778041546407,2026-07-25 16:28:38.506316,2026-07-25 16:29:49.736217,0 days 00:01:11.229901,tanh,2.563326128460741e-05,256,0.0004030682604531692,3,224,32.0,192.0,,COMPLETE
18,0.8788413915460773,2026-07-25 16:29:49.761144,2026-07-25 16:31:25.744381,0 days 00:01:35.983237,tanh,2.1183934783710714e-05,64,0.00041027106625433896,3,352,32.0,192.0,,COMPLETE
19,0.8810865699512461,2026-07-25 16:31:25.767633,2026-07-25 16:32:57.203805,0 days 00:01:31.436172,tanh,0.0007574196438514953,128,0.001059320373526836,3,256,32.0,256.0,,COMPLETE
20,0.857534027671989,2026-07-25 16:32:57.228339,2026-07-25 16:34:56.032771,0 days 00:01:58.804432,tanh,0.10570388884591167,128,0.00130108299159479,3,224,160.0,256.0,,COMPLETE
21,0.8736057468484619,2026-07-25 16:34:56.052944,2026-07-25 16:36:48.191869,0 days 00:01:52.138925,tanh,0.0008071579610582259,128,0.000751863616588543,3,288,32.0,352.0,,COMPLETE
22,0.8717426698073016,2026-07-25 16:36:48.215277,2026-07-25 16:38:23.088139,0 days 00:01:34.872862,tanh,4.3572846045361274e-05,128,0.0002683809582511883,3,256,64.0,160.0,,COMPLETE
23,0.8769061615716209,2026-07-25 16:38:23.132181,2026-07-25 16:39:41.647578,0 days 00:01:18.515397,tanh,9.92866536410256e-06,128,0.000460192300360183,2,352,64.0,,,COMPLETE
24,0.878449887281382,2026-07-25 16:39:41.673562,2026-07-25 16:41:55.845571,0 days 00:02:14.172009,tanh,0.0005917121153142469,256,0.002476902937205229,4,288,32.0,384.0,224.0,COMPLETE
25,0.8801384023834833,2026-07-25 18:39:48.654335,2026-07-25 18:40:43.855900,0 days 00:00:55.201565,tanh,0.013851041848413211,64,0.0002078941455963999,3,192,64.0,96.0,,COMPLETE
26,0.8754484423049946,2026-07-25 18:40:43.889922,2026-07-25 18:42:21.410479,0 days 00:01:37.520557,tanh,0.036623740617886646,64,0.00017394791097420103,3,192,128.0,96.0,,COMPLETE
27,0.8903265917592442,2026-07-25 18:42:21.435098,2026-07-25 18:43:34.644298,0 days 00:01:13.209200,tanh,0.010471688670155587,64,0.000242435736853538,2,192,64.0,,,COMPLETE
28,0.860273182183281,2026-07-25 18:43:34.678795,2026-07-25 18:44:35.761478,0 days 00:01:01.082683,tanh,0.07441768699875612,64,0.00010989400035987641,1,256,,,,COMPLETE
29,0.8852283860844624,2026-07-25 18:44:35.786369,2026-07-25 18:45:21.684112,0 days 00:00:45.897743,relu,0.002500243135943791,64,0.0010556147305182935,2,192,128.0,,,COMPLETE
30,0.8287548800988394,2026-07-25 18:45:21.710063,2026-07-25 18:46:22.220226,0 days 00:01:00.510163,relu,0.9595138148335103,64,0.000293455820140836,2,64,224.0,,,COMPLETE
31,0.8874752201433368,2026-07-25 18:46:22.246174,2026-07-25 18:47:18.788961,0 days 00:00:56.542787,relu,0.0021893279366064088,64,0.0007468137284071234,2,192,128.0,,,COMPLETE
32,0.8960365131019346,2026-07-25 18:47:18.812644,2026-07-25 18:48:37.387722,0 days 00:01:18.575078,relu,0.0035797140842045885,64,0.0008061232239873866,2,160,128.0,,,COMPLETE
33,0.8592536997988759,2026-07-25 18:48:37.420897,2026-07-25 18:48:53.420622,0 days 00:00:15.999725,relu,0.009156772074192548,64,0.0007387573975649847,1,160,,,,COMPLETE
34,0.864907220985695,2026-07-25 18:48:53.444449,2026-07-25 18:50:02.099364,0 days 00:01:08.654915,relu,0.146905418008669,64,0.0005990357682404107,2,160,160.0,,,COMPLETE
35,0.8711724706617752,2026-07-25 18:50:02.122911,2026-07-25 18:50:43.259521,0 days 00:00:41.136610,relu,0.0016228270926059896,64,0.0003250476600649889,2,96,128.0,,,COMPLETE
36,0.8944905697148794,2026-07-25 18:50:43.285213,2026-07-25 18:51:31.094304,0 days 00:00:47.809091,relu,0.00395564866010477,64,0.002082668846827222,2,96,192.0,,,COMPLETE
37,0.8298948351085392,2026-07-25 18:51:31.115857,2026-07-25 18:51:58.105828,0 days 00:00:26.989971,relu,0.004213567000241699,64,0.007268844868293044,2,96,224.0,,,COMPLETE
38,0.8935811686015697,2026-07-25 18:51:58.132355,2026-07-25 18:52:16.469366,0 days 00:00:18.337011,relu,0.0003384499924521647,64,0.0019059772224803407,1,128,,,,COMPLETE
39,0.8603433564815159,2026-07-25 18:52:16.492155,2026-07-25 18:52:26.591543,0 days 00:00:10.099388,relu,0.00028071371007318334,64,0.0025733156698504625,1,32,,,,COMPLETE
40,0.8763329760925366,2026-07-25 18:52:26.616123,2026-07-25 18:52:35.616787,0 days 00:00:09.000664,relu,0.020621322407332974,512,0.004880816733379234,1,64,,,,COMPLETE
41,0.8214030158908301,2026-07-25 18:52:35.640927,2026-07-25 18:53:01.537986,0 days 00:00:25.897059,relu,0.0015037716936214854,64,0.012643500614768424,2,128,192.0,,,COMPLETE
42,0.8898155077934604,2026-07-25 18:53:01.570572,2026-07-25 18:54:08.759780,0 days 00:01:07.189208,relu,0.003987285163222256,64,0.001961139821495642,2,128,288.0,,,COMPLETE
43,0.8684892887473556,2026-07-25 18:54:08.784554,2026-07-25 18:54:19.802510,0 days 00:00:11.017956,relu,0.005082701874404187,64,0.0017569019049255023,1,128,,,,COMPLETE
44,0.8639243108795129,2026-07-25 18:54:19.828421,2026-07-25 18:55:00.575709,0 days 00:00:40.747288,relu,0.040991022436562524,64,0.002412507750085091,2,96,288.0,,,COMPLETE
45,0.8270354143647736,2026-07-25 18:55:00.602570,2026-07-25 18:55:16.672001,0 days 00:00:16.069431,relu,0.009895266170026326,64,0.004776510185907474,2,64,352.0,,,COMPLETE
46,0.8898224881657655,2026-07-25 18:55:16.698945,2026-07-25 18:55:35.854387,0 days 00:00:19.155442,relu,0.00043053098234846574,64,0.001996001183627509,1,160,,,,COMPLETE
47,0.6201403578471736,2026-07-25 18:55:35.881178,2026-07-25 18:55:41.207826,0 days 00:00:05.326648,relu,0.0005464647558509737,64,0.08351622710745375,1,160,,,,COMPLETE
48,0.8515645526635475,2026-07-25 18:55:41.236406,2026-07-25 18:55:52.162682,0 days 00:00:10.926276,relu,7.965846057561816e-05,512,0.0011361837080157628,1,160,,,,COMPLETE
49,0.878970369454983,2026-07-25 18:55:52.185214,2026-07-25 18:56:03.709946,0 days 00:00:11.524732,relu,0.00030661059274075353,64,0.0029404130960726266,1,96,,,,COMPLETE
50,0.8751211737785621,2026-07-25 20:26:28.900581,2026-07-25 20:26:41.880744,0 days 00:00:12.980163,relu,0.0010930061048914346,64,0.0036721352462739166,1,128,,,,COMPLETE
51,0.8816608891579845,2026-07-25 20:26:41.906862,2026-07-25 20:27:43.260598,0 days 00:01:01.353736,relu,0.0034634263569993844,64,0.0017125528691754955,2,128,256.0,,,COMPLETE
52,0.8711626855082162,2026-07-25 20:27:43.286735,2026-07-25 20:28:29.838269,0 days 00:00:46.551534,relu,0.00716074804663522,64,0.005726496574183279,2,160,288.0,,,COMPLETE
53,0.8636953042989375,2026-07-25 20:28:29.864312,2026-07-25 20:30:40.062397,0 days 00:02:10.198085,relu,0.015068534877639247,64,0.009730230005682041,2,192,384.0,,,COMPLETE
54,0.8715429991266328,2026-07-25 20:30:40.098361,2026-07-25 20:31:04.728411,0 days 00:00:24.630050,relu,0.00022557456667714803,64,0.0022676913408282073,1,128,,,,COMPLETE
55,0.8885230539171172,2026-07-25 20:31:04.760861,2026-07-25 20:32:34.457796,0 days 00:01:29.696935,relu,0.0035204665427942435,512,0.0009775596057870427,2,224,320.0,,,COMPLETE
56,0.8890285884584161,2026-07-25 20:32:34.498354,2026-07-25 20:33:12.556394,0 days 00:00:38.058040,relu,0.0004869308882773246,64,0.0014100546037758008,2,160,96.0,,,COMPLETE
57,0.8542914905718799,2026-07-25 20:33:12.588679,2026-07-25 20:33:32.478734,0 days 00:00:19.890055,relu,0.03249576461802155,64,0.0018925353101358012,1,96,,,,COMPLETE
58,0.7558922801095274,2026-07-25 20:33:32.504461,2026-07-25 20:33:45.984338,0 days 00:00:13.479877,relu,0.0011607614437132686,64,0.03323621618577015,2,128,192.0,,,COMPLETE
59,0.8721789467153895,2026-07-25 20:33:46.012180,2026-07-25 20:34:03.321255,0 days 00:00:17.309075,relu,0.00010485676281219394,256,0.0036179556459738638,1,192,,,,COMPLETE
60,0.8587954051622211,2026-07-25 20:34:03.344342,2026-07-25 20:34:42.161393,0 days 00:00:38.817051,relu,0.06484161820161946,64,0.002082911676645028,2,64,256.0,,,COMPLETE
61,0.8832007671148143,2026-07-25 20:34:42.188205,2026-07-25 20:35:20.129525,0 days 00:00:37.941320,relu,0.00038500634794082363,64,0.0014004220668966004,2,160,96.0,,,COMPLETE
62,0.8764753642014773,2026-07-25 20:35:20.153716,2026-07-25 20:35:49.997072,0 days 00:00:29.843356,relu,0.0005668631978413904,64,0.001402900991395084,2,160,96.0,,,COMPLETE
63,0.8962349466186152,2026-07-25 20:35:50.037203,2026-07-25 20:37:50.279846,0 days 00:02:00.242643,relu,5.875775232037901e-05,64,0.0009365779519856359,2,128,64.0,,,COMPLETE
64,0.8870401075410486,2026-07-25 20:37:50.348958,2026-07-25 20:39:04.558867,0 days 00:01:14.209909,relu,1.4505422633898736e-05,64,0.0008533849608556701,2,128,64.0,,,COMPLETE
65,0.8931891184381628,2026-07-25 20:39:04.614652,2026-07-25 20:41:59.326390,0 days 00:02:54.711738,relu,6.495383307679795e-05,64,0.0005886237491106676,2,96,352.0,,,COMPLETE
66,0.8861508751799372,2026-07-25 20:41:59.383772,2026-07-25 20:43:19.338256,0 days 00:01:19.954484,relu,5.720640730371913e-05,128,0.0006144569832699105,2,96,160.0,,,COMPLETE
67,0.8177461585400934,2026-07-25 20:43:19.398788,2026-07-25 20:43:52.997452,0 days 00:00:33.598664,relu,0.000138582213504937,64,0.00015095819385495135,1,32,,,,COMPLETE
68,0.8467689549978726,2026-07-25 20:43:53.045039,2026-07-25 20:48:16.790127,0 days 00:04:23.745088,tanh,4.40448240759497e-06,512,0.00021392302732635464,2,192,352.0,,,COMPLETE
69,0.8750683212682322,2026-07-25 20:48:16.843141,2026-07-25 20:50:06.535040,0 days 00:01:49.691899,relu,2.3209897974139434e-05,256,0.00033924343041820545,3,64,64.0,384.0,,COMPLETE
70,0.8861210394372194,2026-07-25 20:50:06.586416,2026-07-25 20:53:13.906958,0 days 00:03:07.320542,relu,5.981907069883397e-05,64,0.0005570742066180634,2,96,320.0,,,COMPLETE
71,0.89382338245793,2026-07-25 20:53:13.956055,2026-07-25 20:58:40.092047,0 days 00:05:26.135992,relu,0.00018470898509492497,64,0.0009149165881684657,2,128,352.0,,,COMPLETE
72,0.8987142273709234,2026-07-25 20:58:40.156136,2026-07-25 21:06:03.980161,0 days 00:07:23.824025,relu,0.0001703619367708789,64,0.0008797046978422353,2,224,384.0,,,COMPLETE
73,0.8939063995009952,2026-07-25 21:06:04.090771,2026-07-25 21:12:58.578565,0 days 00:06:54.487794,relu,3.473997679473457e-05,64,0.0008295721250800567,2,224,384.0,,,COMPLETE
74,0.8885125452577587,2026-07-25 21:12:58.635093,2026-07-25 21:16:39.597765,0 days 00:03:40.962672,relu,3.992122745425064e-05,64,0.0010047013956233483,2,224,384.0,,,COMPLETE
75,0.8893861966234493,2026-07-26 06:34:13.184479,2026-07-26 06:36:26.068852,0 days 00:02:12.884373,relu,0.00018642898340584993,64,0.0006597833468001687,2,256,352.0,,,COMPLETE
76,0.8740750141401898,2026-07-26 06:36:26.091290,2026-07-26 06:37:03.660508,0 days 00:00:37.569218,relu,1.4372147400115104e-05,64,0.0004738167240835682,2,96,384.0,,,COMPLETE
77,0.8862580447786914,2026-07-26 06:37:03.692814,2026-07-26 06:40:22.161568,0 days 00:03:18.468754,relu,8.710806166042073e-05,128,0.0007927426494695427,2,288,352.0,,,COMPLETE
78,0.8697732963916058,2026-07-26 06:40:22.194404,2026-07-26 06:41:02.501387,0 days 00:00:40.306983,relu,5.404967079222682e-05,64,0.0008950482300605734,2,64,384.0,,,COMPLETE
79,0.8825399073062674,2026-07-26 06:41:02.535191,2026-07-26 06:44:04.745815,0 days 00:03:02.210624,relu,2.8140356683288853e-05,64,0.0011231994630008988,3,224,352.0,320.0,,COMPLETE
80,0.8714406975508797,2026-07-26 06:44:04.769626,2026-07-26 06:45:32.690721,0 days 00:01:27.921095,relu,0.00014039037476746842,64,0.0003779792596910193,2,128,320.0,,,COMPLETE
81,0.8615378120868827,2026-07-26 06:45:32.715875,2026-07-26 06:47:21.788662,0 days 00:01:49.072787,tanh,7.099147233945396e-06,64,0.0012245430203407218,2,192,384.0,,,COMPLETE
82,0.877894528742914,2026-07-26 06:47:21.823512,2026-07-26 06:50:10.228071,0 days 00:02:48.404559,tanh,0.00027780010891618903,64,0.0005148740249101933,2,224,352.0,,,COMPLETE
83,0.8881583195402665,2026-07-26 06:50:10.251750,2026-07-26 06:52:33.040004,0 days 00:02:22.788254,relu,1.5825697138156486e-05,64,0.0016053145302373526,2,224,320.0,,,COMPLETE
84,0.8719140552545047,2026-07-26 06:52:33.067045,2026-07-26 06:54:23.066740,0 days 00:01:49.999695,relu,0.00086289351041417,64,0.0006687857645743437,2,192,384.0,,,COMPLETE
85,0.8656046182030588,2026-07-26 06:54:23.089608,2026-07-26 06:55:09.799903,0 days 00:00:46.710295,relu,8.132131093278927e-05,64,0.0002306660584911592,2,128,64.0,,,COMPLETE
86,0.8676860171942233,2026-07-26 06:55:09.823639,2026-07-26 06:57:06.221754,0 days 00:01:56.398115,tanh,0.00018913128492468374,64,0.002750594492847376,2,256,384.0,,,COMPLETE
87,0.8730774980005411,2026-07-26 06:57:06.248777,2026-07-26 06:58:15.801122,0 days 00:01:09.552345,relu,1.8202983504851416e-06,64,0.0004061006384940148,2,128,352.0,,,COMPLETE
88,0.8543459939950726,2026-07-26 06:58:15.823681,2026-07-26 06:58:33.981072,0 days 00:00:18.157391,relu,0.00275356933978931,512,0.000889795358683924,2,96,96.0,,,COMPLETE
89,0.863223043645718,2026-07-26 06:58:34.005795,2026-07-26 06:59:15.686984,0 days 00:00:41.681189,relu,0.009994538992321425,256,0.0012101850744856164,2,160,320.0,,,COMPLETE
90,0.8737559571555449,2026-07-26 06:59:15.710717,2026-07-26 07:00:10.101557,0 days 00:00:54.390840,relu,3.657132485622959e-05,64,0.00028645421258947554,3,192,64.0,64.0,,COMPLETE
91,0.8588511347055711,2026-07-26 07:00:10.125475,2026-07-26 07:00:27.835202,0 days 00:00:17.709727,relu,0.0059253176073967954,64,0.0016080958369383968,1,160,,,,COMPLETE
92,0.874208051124935,2026-07-26 07:00:27.865041,2026-07-26 07:01:20.777126,0 days 00:00:52.912085,relu,0.00010091384247525429,64,0.0021119883412370317,2,160,192.0,,,COMPLETE
93,0.8673191628609661,2026-07-26 07:01:20.814691,2026-07-26 07:01:41.215366,0 days 00:00:20.400675,relu,0.0004062313100328594,64,0.0030301667406887204,1,128,,,,COMPLETE
94,0.8821615014218027,2026-07-26 07:01:41.246517,2026-07-26 07:02:58.138604,0 days 00:01:16.892087,relu,0.0018051883279782926,64,0.0007156189411687614,2,224,128.0,,,COMPLETE
95,0.8725477599286293,2026-07-26 07:02:58.161284,2026-07-26 07:03:32.808141,0 days 00:00:34.646857,relu,0.0002549318131040591,64,0.004343033321527979,2,96,160.0,,,COMPLETE
96,0.7951824945329697,2026-07-26 07:03:32.835401,2026-07-26 07:03:44.614009,0 days 00:00:11.778608,tanh,0.18229367817159875,64,0.0009763011126569177,1,192,,,,COMPLETE
97,0.8661415533739212,2026-07-26 07:03:44.638827,2026-07-26 07:04:39.690287,0 days 00:00:55.051460,relu,1.133442188561084e-06,64,0.0005765852685484451,2,160,256.0,,,COMPLETE
98,0.8600732860542598,2026-07-26 07:04:39.714145,2026-07-26 07:04:53.403504,0 days 00:00:13.689359,relu,6.955586214073044e-05,128,0.0012825670260434103,1,128,,,,COMPLETE
99,0.8464662197881745,2026-07-26 07:04:53.442419,2026-07-26 07:05:30.895625,0 days 00:00:37.453206,relu,0.017052441719736973,64,0.00011560962845581161,2,160,32.0,,,COMPLETE
100,0.8798669986776979,2026-07-26 11:22:46.376199,2026-07-26 11:23:58.650657,0 days 00:01:12.274458,relu,0.00036438457970210044,64,0.0007974334868273975,2,128,352.0,,,COMPLETE
101,0.8679138455820319,2026-07-26 11:23:58.681245,2026-07-26 11:24:27.574606,0 days 00:00:28.893361,relu,0.00494791520445861,64,0.002080477359392876,2,96,384.0,,,COMPLETE
102,0.8795938332821369,2026-07-26 11:24:27.601863,2026-07-26 11:25:02.136254,0 days 00:00:34.534391,relu,0.002856627648215252,64,0.001738228654110242,2,128,288.0,,,COMPLETE
103,0.8647002389217485,2026-07-26 11:25:02.179071,2026-07-26 11:25:24.071642,0 days 00:00:21.892571,relu,0.007947068086264187,64,0.002443423988591239,2,96,224.0,,,COMPLETE
104,0.8757233533116568,2026-07-26 11:25:24.108674,2026-07-26 11:25:42.168493,0 days 00:00:18.059819,relu,4.481003088311754e-05,64,0.001450293689112796,2,128,128.0,,,COMPLETE
105,0.8834829941642175,2026-07-26 11:25:42.196367,2026-07-26 11:43:45.942840,0 days 00:18:03.746473,relu,0.0007193709712306765,64,0.003384259291243871,2,160,352.0,,,COMPLETE
106,0.8655276837171133,2026-07-26 11:43:45.970876,2026-07-26 11:44:40.557334,0 days 00:00:54.586458,relu,0.012691051199309331,64,0.001066239324462759,2,128,320.0,,,COMPLETE
107,0.874049762610092,2026-07-26 11:44:40.588882,2026-07-26 11:46:16.799611,0 days 00:01:36.210729,tanh,0.0012368224932551915,64,0.0004610823442551931,2,192,384.0,,,COMPLETE
108,0.8221060886798103,2026-07-26 11:46:16.834368,2026-07-26 11:46:36.745688,0 days 00:00:19.911320,relu,0.00014777003442370228,256,0.00017192610800281416,1,256,,,,COMPLETE
109,0.8710055361026889,2026-07-26 11:46:36.772338,2026-07-26 11:47:04.286410,0 days 00:00:27.514072,relu,9.85612636469538e-06,512,0.0009295018514227279,2,64,288.0,,,COMPLETE
110,0.8779990123339078,2026-07-26 11:47:04.317159,2026-07-26 11:47:28.124915,0 days 00:00:23.807756,relu,0.00011485331908263952,64,0.0018711048996008551,2,160,96.0,,,COMPLETE
111,0.8717945755518252,2026-07-26 11:47:28.147515,2026-07-26 11:49:43.275062,0 days 00:02:15.127547,relu,0.0002128017574870786,64,0.000609386217142359,2,256,352.0,,,COMPLETE
112,0.8854828895615172,2026-07-26 11:49:43.302566,2026-07-26 11:51:38.448156,0 days 00:01:55.145590,relu,0.00017513400071284438,64,0.0006984576944233219,2,288,352.0,,,COMPLETE
113,0.8886662471320614,2026-07-26 11:51:38.473011,2026-07-26 11:54:00.532540,0 days 00:02:22.059529,relu,5.3468564208941507e-05,64,0.0005182067507781336,2,256,384.0,,,COMPLETE
114,0.8845995332375833,2026-07-26 11:54:00.557945,2026-07-26 11:55:59.249016,0 days 00:01:58.691071,relu,0.00012260223272704746,64,0.0006509328083247875,2,224,352.0,,,COMPLETE
115,0.8686685169721062,2026-07-26 11:55:59.301710,2026-07-26 11:57:56.900294,0 days 00:01:57.598584,relu,0.02562525382755453,64,0.0008079467752817259,2,224,384.0,,,COMPLETE
116,0.882332983073268,2026-07-26 11:57:56.927770,2026-07-26 11:58:42.974617,0 days 00:00:46.046847,relu,3.090471667583741e-05,64,0.001156407552867277,2,96,320.0,,,COMPLETE
117,0.8731776765230501,2026-07-26 11:58:42.998984,2026-07-26 11:59:08.417758,0 days 00:00:25.418774,tanh,0.0003338715640246237,64,0.001489120329731382,2,128,192.0,,,COMPLETE
118,0.8642974656530766,2026-07-26 11:59:08.440396,2026-07-26 11:59:23.736547,0 days 00:00:15.296151,relu,0.004155691803147449,64,0.0020155180724390938,2,256,64.0,,,COMPLETE
119,0.8810533193678933,2026-07-26 11:59:23.760017,2026-07-26 12:01:55.066527,0 days 00:02:31.306510,relu,0.0022886274732042923,128,0.0003220609796220329,4,288,256.0,288.0,288.0,COMPLETE
120,0.8726492580962033,2026-07-26 12:01:55.104327,2026-07-26 12:02:10.054282,0 days 00:00:14.949955,relu,0.000832474246544037,64,0.0013445033447691131,2,96,32.0,,,COMPLETE
121,0.8603843844952095,2026-07-26 12:02:10.076823,2026-07-26 12:02:32.013145,0 days 00:00:21.936322,relu,0.0005729663887771839,64,0.0010873429758033709,2,160,96.0,,,COMPLETE
122,0.8750555272491873,2026-07-26 12:02:32.039751,2026-07-26 12:02:57.114552,0 days 00:00:25.074801,relu,0.00018365718374503809,64,0.0025936374562657073,2,160,64.0,,,COMPLETE
123,0.8744328033270159,2026-07-26 12:02:57.161634,2026-07-26 12:03:39.861281,0 days 00:00:42.699647,relu,0.00044340634121185714,64,0.0015689467758650342,2,128,96.0,,,COMPLETE
