number,value,datetime_start,datetime_complete,duration,params_activation,params_alpha,params_batch_size,params_learning_rate_init,params_n_layers,params_n_units_l0,params_n_units_l1,params_n_units_l2,params_n_units_l3,state
124,0.8869090259806032,2026-07-26 12:03:39.894260,2026-07-26 12:04:37.584558,0 days 00:00:57.690298,relu,8.017871376324238e-05,64,0.0008301582622799653,2,192,96.0,,,COMPLETE
